{"alternative_categories":{"categories":[],"state":"unresolved"},"authority_points":[],"branch_budget":3,"content_sha256":"2d69b4a6536f9a84c227ab751ca4ee8ca8bcfcd9af8fdece5801eecc6c8378b4","display_name":{"en":"Field-general fallback","zh_TW":"領域通用後備設定"},"known_exclusions":[],"overflow_behavior":"ask_merge_park_archive","profile_id":"field_general","profile_version":"1.0.0","provenance":{"freshness_state":"current","last_reviewed_at":"2026-08-24","source":"shipped_default","source_pointer":"shared/research_workflow_profiles/field_general.json"},"research_family":"field_general","schema_version":"research-workflow-profile/1.0","stage_map":{"drafting":{"state":"unresolved_fit"},"finalization":{"state":"unresolved_fit"},"integrity_check":{"state":"applicable"},"methodology":{"state":"unresolved_fit"},"retrieval":{"state":"unresolved_fit"},"review":{"state":"unresolved_fit"},"revision":{"state":"unresolved_fit"},"rq_formation":{"state":"unresolved_fit"},"synthesis":{"state":"unresolved_fit"}},"unresolved_fit_note":"Field-specific stage applicability, alternative categories, and authority requirements remain unvalidated; ask the user before treating them as resolved."}